{
  "id": "void_crawler",
  "name": "Void Crawler",
  "description": "Something adapted to the deep places where the Void Crystal — the Black Aetherium, the drained lattice left by the Cascade — is densest. It looks like it was once insectoid and has been through several iterations since. The eyes are gone; it navigates by the resonance field generated by the active crystals around it, which means the Grid restart eight months ago woke more of them than anyone anticipated. They move in low-light conditions at unsettling speed, attack with serrated forelimbs that drain warmth from the wound, and they are drawn to the body heat of the living with a precision that suggests the absence of heat in their own bodies.",
  "base_stats": {
    "hp": 48,
    "attack": 10,
    "defense": 3,
    "intelligence": 0
  },
  "abilities": [
    {
      "id": "heat_drain",
      "name": "Heat Drain",
      "description": "A full-body strike using all six forelimbs simultaneously, designed to maximize contact area. Each wound bleeds cold — the surrounding tissue loses warmth over the next several seconds.",
      "base_damage": 8,
      "applies_effect": "bleed",
      "effect_damage": 5,
      "effect_duration": 2
    }
  ],
  "passives": [],
  "starting_equipment": [],
  "xp_reward": 42,
  "gold_reward": 8,
  "tactics": [
    {
      "condition": { "type": "hp_below", "threshold": 0.5 },
      "action": { "type": "heavy_attack", "multiplier": 1.3 }
    },
    {
      "condition": { "type": "always" },
      "action": { "type": "basic_attack" }
    }
  ]
}
